{
  "id": "cli-help",
  "specRefs": ["BC-30", "BC-36", "OF-10", "OF-12"],
  "fixture": {},
  "run": { "argv": ["--help"] },
  "expect": {
    "exitCode": 0,
    "stdoutExact": "▍ SWEEP-NM  工作区 node_modules 清理\n\n  sweep-nm                   预览: 清单 + 体积 + 合计, 零副作用\n  sweep-nm --yes             执行删除\n  sweep-nm --force           连同疑似安装树一并删除 (默认跳过)\n  sweep-nm --exclude <name>  临时追加排除 (可重复, 与配置合并)\n  sweep-nm --include <name>  只清理命中名单的目录 (可重复, 与配置合并)\n  sweep-nm --config <path>   指定配置文件 (优先于 SWEEP_NM_CONFIG)\n  sweep-nm config            查看实际生效的配置: 来源 + 路径 + 文件状态\n  sweep-nm init              初始化向导: 交互生成配置文件\n  sweep-nm --help            帮助\n  sweep-nm -h                --help 的别名\n\n说明:\n  --exclude 按目录名精确匹配 (区分大小写), 从根到命中点的任意一级命中即跳过\n  --include 同款匹配口径, 命中才纳入; 同时命中 exclude 的照旧跳过\n  配置未写 exclude 字段时使用内置默认名单 (包管理器 / 版本管理器 / 编辑器扩展等安装树目录)\n  --force 只放行「疑似安装树」(安装树形态的目标), 不放宽删除安全闸\n  删除侧要求扫描根为真实路径 (根及其祖先链不含符号链接): 命中 (如 /tmp、/var 形态) 则 --yes 整批拒绝, 改写为真实路径形态 (如 /private/tmp/x) 即放行\n  默认配置位置 (平台自适应; 用了 --config 或 SWEEP_NM_CONFIG 时实际读的不是它): $FIXTURE/home/.config/sweep-node-modules/config.json\n  查实际生效的路径: sweep-nm config\n\n退出码: 0 成功 (含预览与空结果); 1 删除失败或跳过 / 配置损坏 / 参数错误\n"
  }
}
